{
  "schema": "design-pipeline.frontend-stack-registry.v1",
  "version": "1",
  "reviewedAt": "2026-08-14",
  "styling": [
    { "id": "tailwindcss", "aliases": ["tailwind"], "label": "Tailwind CSS" },
    { "id": "scss", "aliases": ["sass"], "label": "SCSS" },
    { "id": "less", "aliases": [], "label": "Less" },
    { "id": "postcss-only", "aliases": ["postcss"], "label": "PostCSS-only" },
    { "id": "none", "aliases": [], "label": "None" }
  ],
  "uiLibraries": [
    { "id": "shadcn-ui", "aliases": ["shadcn", "shadcn/ui"], "label": "shadcn/ui", "frameworks": ["react"], "requiredStyling": ["tailwindcss"], "license": "MIT", "sourceId": "shadcn-ui/ui", "source": "https://github.com/shadcn-ui/ui" },
    { "id": "shadcn-svelte", "aliases": ["shadcn/svelte"], "label": "shadcn-svelte", "frameworks": ["svelte"], "requiredStyling": ["tailwindcss"], "license": "MIT", "sourceId": "huntabyte/shadcn-svelte", "source": "https://github.com/huntabyte/shadcn-svelte" },
    { "id": "daisyui", "aliases": ["daisyUI"], "label": "daisyUI", "frameworks": ["agnostic"], "requiredStyling": ["tailwindcss"], "license": "MIT", "sourceId": "saadeghi/daisyui", "source": "https://github.com/saadeghi/daisyui" },
    { "id": "radix-ui", "aliases": ["radix"], "label": "Radix UI", "frameworks": ["react"], "license": "MIT", "sourceId": "radix-ui/primitives", "source": "https://github.com/radix-ui/primitives" },
    { "id": "headless-ui", "aliases": ["headlessui"], "label": "Headless UI", "frameworks": ["react", "vue"], "license": "MIT", "sourceId": "tailwindlabs/headlessui", "source": "https://github.com/tailwindlabs/headlessui" },
    { "id": "park-ui", "aliases": ["park"], "label": "Park UI", "frameworks": ["react", "solid"], "externalStyleEngine": "panda-css", "license": "MIT", "sourceId": "chakra-ui/park-ui", "source": "https://github.com/chakra-ui/park-ui" },
    { "id": "chakra-ui", "aliases": ["chakra"], "label": "Chakra UI", "frameworks": ["react"], "externalStyleEngine": "emotion", "license": "MIT", "sourceId": "chakra-ui/chakra-ui", "source": "https://github.com/chakra-ui/chakra-ui" },
    { "id": "heroui", "aliases": ["nextui", "next-ui"], "label": "HeroUI (formerly NextUI)", "frameworks": ["react"], "requiredStyling": ["tailwindcss"], "license": "Apache-2.0", "sourceId": "heroui-inc/heroui", "source": "https://github.com/heroui-inc/heroui" },
    { "id": "mantine", "aliases": [], "label": "Mantine", "frameworks": ["react"], "license": "MIT", "sourceId": "mantinedev/mantine", "source": "https://github.com/mantinedev/mantine" },
    { "id": "mui", "aliases": ["material-ui"], "label": "MUI", "frameworks": ["react"], "externalStyleEngine": "emotion", "license": "MIT", "sourceId": "mui/material-ui", "source": "https://github.com/mui/material-ui" },
    { "id": "ant-design", "aliases": ["antd"], "label": "Ant Design", "frameworks": ["react"], "externalStyleEngine": "css-in-js", "license": "MIT", "sourceId": "ant-design/ant-design", "source": "https://github.com/ant-design/ant-design" },
    { "id": "base-ui", "aliases": ["baseui"], "label": "Base UI", "frameworks": ["react"], "license": "MIT", "sourceId": "mui/base-ui", "source": "https://github.com/mui/base-ui" },
    { "id": "ark-ui", "aliases": ["arkui"], "label": "Ark UI", "frameworks": ["react", "solid", "vue", "svelte"], "license": "MIT", "sourceId": "chakra-ui/ark", "source": "https://github.com/chakra-ui/ark" },
    { "id": "react-aria", "aliases": ["reactaria"], "label": "React Aria", "frameworks": ["react"], "license": "Apache-2.0", "sourceId": "adobe/react-spectrum", "source": "https://github.com/adobe/react-spectrum" },
    { "id": "none", "aliases": [], "label": "None", "frameworks": ["agnostic"], "license": "project", "sourceId": "project-components", "source": "project-owned" }
  ],
  "shadcn": {
    "sourceId": "shadcn-ui/ui",
    "source": "https://github.com/shadcn-ui/ui",
    "revision": "a85299a9edd2a961e32f01ced86963a852652bd2",
    "bases": ["radix", "base", "aria"],
    "styles": ["nova", "vega", "maia", "lyra", "mira", "luma", "sera", "rhea"],
    "baseColors": ["neutral", "stone", "zinc", "gray", "mauve", "olive", "mist", "taupe"],
    "themes": ["neutral", "stone", "zinc", "gray", "amber", "blue", "cyan", "emerald", "fuchsia", "green", "indigo", "lime", "orange", "pink", "purple", "red", "rose", "sky", "teal", "violet", "yellow", "mauve", "olive", "mist", "taupe"],
    "chartColors": ["neutral", "stone", "zinc", "gray", "amber", "blue", "cyan", "emerald", "fuchsia", "green", "indigo", "lime", "orange", "pink", "purple", "red", "rose", "sky", "teal", "violet", "yellow", "mauve", "olive", "mist", "taupe"],
    "iconLibraries": ["lucide", "hugeicons", "tabler", "phosphor", "remixicon"],
    "fonts": ["inter", "noto-sans", "nunito-sans", "figtree", "roboto", "raleway", "dm-sans", "public-sans", "outfit", "jetbrains-mono", "geist", "geist-mono", "lora", "merriweather", "playfair-display", "noto-serif", "roboto-slab", "oxanium", "manrope", "space-grotesk", "montserrat", "ibm-plex-sans", "source-sans-3", "instrument-sans", "eb-garamond", "instrument-serif"],
    "fontHeadings": ["inherit", "inter", "noto-sans", "nunito-sans", "figtree", "roboto", "raleway", "dm-sans", "public-sans", "outfit", "jetbrains-mono", "geist", "geist-mono", "lora", "merriweather", "playfair-display", "noto-serif", "roboto-slab", "oxanium", "manrope", "space-grotesk", "montserrat", "ibm-plex-sans", "source-sans-3", "instrument-sans", "eb-garamond", "instrument-serif"],
    "radii": ["default", "none", "small", "medium", "large"],
    "menuAccents": ["subtle", "bold"],
    "menuColors": ["default", "inverted", "default-translucent", "inverted-translucent"],
    "defaults": {
      "nova": { "base": "radix", "style": "nova", "baseColor": "neutral", "theme": "neutral", "chartColor": "neutral", "iconLibrary": "lucide", "font": "geist", "fontHeading": "inherit", "menuAccent": "subtle", "menuColor": "default", "radius": "default" },
      "vega": { "base": "radix", "style": "vega", "baseColor": "neutral", "theme": "neutral", "chartColor": "neutral", "iconLibrary": "lucide", "font": "inter", "fontHeading": "inherit", "menuAccent": "subtle", "menuColor": "default", "radius": "default" },
      "maia": { "base": "radix", "style": "maia", "baseColor": "neutral", "theme": "neutral", "chartColor": "neutral", "iconLibrary": "hugeicons", "font": "figtree", "fontHeading": "inherit", "menuAccent": "subtle", "menuColor": "default", "radius": "default" },
      "lyra": { "base": "radix", "style": "lyra", "baseColor": "neutral", "theme": "neutral", "chartColor": "neutral", "iconLibrary": "phosphor", "font": "jetbrains-mono", "fontHeading": "inherit", "menuAccent": "subtle", "menuColor": "default", "radius": "default" },
      "mira": { "base": "radix", "style": "mira", "baseColor": "neutral", "theme": "neutral", "chartColor": "neutral", "iconLibrary": "hugeicons", "font": "inter", "fontHeading": "inherit", "menuAccent": "subtle", "menuColor": "default", "radius": "default" },
      "luma": { "base": "radix", "style": "luma", "baseColor": "neutral", "theme": "neutral", "chartColor": "neutral", "iconLibrary": "lucide", "font": "inter", "fontHeading": "inherit", "menuAccent": "subtle", "menuColor": "default", "radius": "default" },
      "sera": { "base": "radix", "style": "sera", "baseColor": "taupe", "theme": "taupe", "chartColor": "taupe", "iconLibrary": "lucide", "font": "noto-sans", "fontHeading": "playfair-display", "menuAccent": "subtle", "menuColor": "default", "radius": "default" },
      "rhea": { "base": "radix", "style": "rhea", "baseColor": "neutral", "theme": "neutral", "chartColor": "neutral", "iconLibrary": "lucide", "font": "inter", "fontHeading": "inherit", "menuAccent": "subtle", "menuColor": "default", "radius": "default" }
    }
  },
  "tools": [
    {
      "id": "vitejs/devtools",
      "capabilities": ["vite-devtools", "vite-plugin-inspection", "build-analysis", "test-inspection"],
      "activation": "keyword",
      "keywords": ["vite devtools", "vite+ devtools", "@vitejs/devtools", "vite plugin inspector"],
      "mode": "project-pinned-adapter",
      "status": "review",
      "sourceId": "vitejs/devtools",
      "source": "https://devtools.vite.dev/",
      "repository": "https://github.com/vitejs/devtools",
      "reviewedAt": "2026-10-07",
      "license": "MIT",
      "requirements": ["Vite 8 and a project-local @vitejs/devtools preview dependency", "Enable standalone or embedded mode explicitly in the target project's Vite configuration", "A Vite+ project may provide the Vite 8 runtime through @voidzero-dev/vite-plus-core"],
      "constraints": ["Probe only; never install, upgrade, or rewrite target-project configuration automatically", "Treat Vite DevTools as early preview and preserve the existing Playwright evidence fallback", "Do not claim integration-specific evidence unless that integration is installed and mounted"],
      "fallback": "Use the project-owned Vite command and the bundled Playwright evidence adapter.",
      "lifecycle": {
        "probe": {
          "kind": "command",
          "command": ["node", "-e", "const fs=require('node:fs'),p=require('node:path');const read=n=>{const f=p.join(process.cwd(),'node_modules',...n.split('/'),'package.json');return fs.existsSync(f)?JSON.parse(fs.readFileSync(f,'utf8')).version:null};const d=read('@vitejs/devtools'),v=read('vite'),vp=read('vite-plus');if(!d)process.exit(2);process.stdout.write(`devtools=${d};vite=${v||'unknown'};vite-plus=${vp||'absent'}`)"],
          "timeoutMs": 5000
        },
        "invoke": {"kind": "managed-cli", "owner": "agent", "target": "project-local vite-devtools binary", "command": ["vite-devtools", "--root", ".", "--no-open"]},
        "verify": {"receiptSchema": "design-pipeline.toolchain-receipt.v1", "evidenceTypes": ["devtools-availability", "mounted-integrations", "browser-console", "playwright-trace"]}
      }
    },